{
  "schema_version": "1.0.0",
  "module_id": "ABS.MODULE.CAPABILITY.CONNECTORS",
  "policy_version": "1.0.0",
  "scope_id": "ABS.SCOPE.ABS_MODULE_CAPABILITY_CONNECTORS.OPERATING_CONTRACT",
  "truth_scope": [
    "ABS.CONCEPT.CONNECTORS_MCP"
  ],
  "default_action": "DENY_UNLESS_SCOPE_AUTHORITY_PERMISSION_AND_EVIDENCE_ARE_VALID",
  "rules": [
    {
      "rule_id": "ABS.MODULE.CAPABILITY.CONNECTORS.RULE.001",
      "requirement_id": "ABS.REQ.CONNECTORS_MCP.001",
      "condition": "governed action or claim is in module scope",
      "effect": "REQUIRE_CONFORMANCE_AND_EVIDENCE",
      "on_failure": "BLOCK_AND_RECORD_FINDING"
    },
    {
      "rule_id": "ABS.MODULE.CAPABILITY.CONNECTORS.RULE.002",
      "requirement_id": "ABS.REQ.CONNECTORS_MCP.002",
      "condition": "governed action or claim is in module scope",
      "effect": "REQUIRE_CONFORMANCE_AND_EVIDENCE",
      "on_failure": "BLOCK_AND_RECORD_FINDING"
    },
    {
      "rule_id": "ABS.MODULE.CAPABILITY.CONNECTORS.RULE.003",
      "requirement_id": "ABS.REQ.CONNECTORS_MCP.003",
      "condition": "governed action or claim is in module scope",
      "effect": "REQUIRE_CONFORMANCE_AND_EVIDENCE",
      "on_failure": "BLOCK_AND_RECORD_FINDING"
    }
  ],
  "states": [
    "UNAVAILABLE",
    "DISCOVERED",
    "READ_ONLY",
    "WRITE_SCOPED",
    "DEGRADED",
    "REVOKED"
  ],
  "transitions": [
    {
      "from": "UNAVAILABLE",
      "to": "DISCOVERED",
      "requires": [
        "valid_scope",
        "authority",
        "permission",
        "evidence_or_explicit_not_run"
      ]
    },
    {
      "from": "DISCOVERED",
      "to": "READ_ONLY",
      "requires": [
        "valid_scope",
        "authority",
        "permission",
        "evidence_or_explicit_not_run"
      ]
    },
    {
      "from": "READ_ONLY",
      "to": "WRITE_SCOPED",
      "requires": [
        "valid_scope",
        "authority",
        "permission",
        "evidence_or_explicit_not_run"
      ]
    },
    {
      "from": "WRITE_SCOPED",
      "to": "DEGRADED",
      "requires": [
        "valid_scope",
        "authority",
        "permission",
        "evidence_or_explicit_not_run"
      ]
    },
    {
      "from": "DEGRADED",
      "to": "REVOKED",
      "requires": [
        "valid_scope",
        "authority",
        "permission",
        "evidence_or_explicit_not_run"
      ]
    }
  ],
  "fail_closed_on": [
    "connector content or availability is trusted without preflight",
    "missing authority",
    "stale evidence",
    "semantic contradiction"
  ],
  "recovery": [
    "stop affected action",
    "restore checkpoint or safe state",
    "repair canonical source/policy",
    "rerun transitive checks"
  ],
  "approval_boundary": [
    "external_write",
    "destructive_action",
    "credential_access",
    "publication",
    "financial_commitment",
    "permission_expansion"
  ],
  "invalidation_triggers": [
    "requirement_change",
    "schema_change",
    "policy_change",
    "interface_change",
    "security_change",
    "candidate_hash_change"
  ]
}
