{
  "schema_version": "1.0.0",
  "module_id": "ABS.MODULE.ENFORCEMENT.OBSERVABILITY",
  "policy_version": "1.0.0",
  "scope_id": "ABS.SCOPE.ABS_MODULE_ENFORCEMENT_OBSERVABILITY.OPERATING_CONTRACT",
  "truth_scope": [
    "ABS.CONCEPT.OBSERVABILITY_INCIDENT"
  ],
  "default_action": "DENY_UNLESS_SCOPE_AUTHORITY_PERMISSION_AND_EVIDENCE_ARE_VALID",
  "rules": [
    {
      "rule_id": "ABS.MODULE.ENFORCEMENT.OBSERVABILITY.RULE.001",
      "requirement_id": "ABS.REQ.OBSERVABILITY_INCIDENT.001",
      "condition": "governed action or claim is in module scope",
      "effect": "REQUIRE_CONFORMANCE_AND_EVIDENCE",
      "on_failure": "BLOCK_AND_RECORD_FINDING"
    },
    {
      "rule_id": "ABS.MODULE.ENFORCEMENT.OBSERVABILITY.RULE.002",
      "requirement_id": "ABS.REQ.OBSERVABILITY_INCIDENT.002",
      "condition": "governed action or claim is in module scope",
      "effect": "REQUIRE_CONFORMANCE_AND_EVIDENCE",
      "on_failure": "BLOCK_AND_RECORD_FINDING"
    },
    {
      "rule_id": "ABS.MODULE.ENFORCEMENT.OBSERVABILITY.RULE.003",
      "requirement_id": "ABS.REQ.OBSERVABILITY_INCIDENT.003",
      "condition": "governed action or claim is in module scope",
      "effect": "REQUIRE_CONFORMANCE_AND_EVIDENCE",
      "on_failure": "BLOCK_AND_RECORD_FINDING"
    }
  ],
  "states": [
    "HEALTHY",
    "DEGRADED",
    "PARTIAL",
    "DEPENDENCY_FAILED",
    "UNKNOWN",
    "UNTESTED",
    "STALE",
    "MISCONFIGURED"
  ],
  "transitions": [
    {
      "from": "HEALTHY",
      "to": "DEGRADED",
      "requires": [
        "valid_scope",
        "authority",
        "permission",
        "evidence_or_explicit_not_run"
      ]
    },
    {
      "from": "DEGRADED",
      "to": "PARTIAL",
      "requires": [
        "valid_scope",
        "authority",
        "permission",
        "evidence_or_explicit_not_run"
      ]
    },
    {
      "from": "PARTIAL",
      "to": "DEPENDENCY_FAILED",
      "requires": [
        "valid_scope",
        "authority",
        "permission",
        "evidence_or_explicit_not_run"
      ]
    },
    {
      "from": "DEPENDENCY_FAILED",
      "to": "UNKNOWN",
      "requires": [
        "valid_scope",
        "authority",
        "permission",
        "evidence_or_explicit_not_run"
      ]
    },
    {
      "from": "UNKNOWN",
      "to": "UNTESTED",
      "requires": [
        "valid_scope",
        "authority",
        "permission",
        "evidence_or_explicit_not_run"
      ]
    },
    {
      "from": "UNTESTED",
      "to": "STALE",
      "requires": [
        "valid_scope",
        "authority",
        "permission",
        "evidence_or_explicit_not_run"
      ]
    },
    {
      "from": "STALE",
      "to": "MISCONFIGURED",
      "requires": [
        "valid_scope",
        "authority",
        "permission",
        "evidence_or_explicit_not_run"
      ]
    }
  ],
  "fail_closed_on": [
    "silence or stale probe is labeled healthy",
    "missing authority",
    "stale evidence",
    "semantic contradiction"
  ],
  "recovery": [
    "stop affected action",
    "restore checkpoint or safe state",
    "repair canonical source/policy",
    "rerun transitive checks"
  ],
  "approval_boundary": [
    "external_write",
    "destructive_action",
    "credential_access",
    "publication",
    "financial_commitment",
    "permission_expansion"
  ],
  "invalidation_triggers": [
    "requirement_change",
    "schema_change",
    "policy_change",
    "interface_change",
    "security_change",
    "candidate_hash_change"
  ]
}
