{
  "schema_version": "1.0.0",
  "module_id": "ABS.MODULE.KNOWLEDGE.GRAPH",
  "policy_version": "1.0.0",
  "scope_id": "ABS.SCOPE.ABS_MODULE_KNOWLEDGE_GRAPH.OPERATING_CONTRACT",
  "truth_scope": [
    "ABS.CONCEPT.REGISTRIES_GRAPH_CONTEXT"
  ],
  "default_action": "DENY_UNLESS_SCOPE_AUTHORITY_PERMISSION_AND_EVIDENCE_ARE_VALID",
  "rules": [
    {
      "rule_id": "ABS.MODULE.KNOWLEDGE.GRAPH.RULE.001",
      "requirement_id": "ABS.REQ.REGISTRIES_GRAPH_CONTEXT.001",
      "condition": "governed action or claim is in module scope",
      "effect": "REQUIRE_CONFORMANCE_AND_EVIDENCE",
      "on_failure": "BLOCK_AND_RECORD_FINDING"
    },
    {
      "rule_id": "ABS.MODULE.KNOWLEDGE.GRAPH.RULE.002",
      "requirement_id": "ABS.REQ.REGISTRIES_GRAPH_CONTEXT.002",
      "condition": "governed action or claim is in module scope",
      "effect": "REQUIRE_CONFORMANCE_AND_EVIDENCE",
      "on_failure": "BLOCK_AND_RECORD_FINDING"
    },
    {
      "rule_id": "ABS.MODULE.KNOWLEDGE.GRAPH.RULE.003",
      "requirement_id": "ABS.REQ.REGISTRIES_GRAPH_CONTEXT.003",
      "condition": "governed action or claim is in module scope",
      "effect": "REQUIRE_CONFORMANCE_AND_EVIDENCE",
      "on_failure": "BLOCK_AND_RECORD_FINDING"
    }
  ],
  "states": [
    "REGISTERED",
    "INDEXED",
    "QUERYABLE",
    "STALE",
    "REBUILDING",
    "QUARANTINED"
  ],
  "transitions": [
    {
      "from": "REGISTERED",
      "to": "INDEXED",
      "requires": [
        "valid_scope",
        "authority",
        "permission",
        "evidence_or_explicit_not_run"
      ]
    },
    {
      "from": "INDEXED",
      "to": "QUERYABLE",
      "requires": [
        "valid_scope",
        "authority",
        "permission",
        "evidence_or_explicit_not_run"
      ]
    },
    {
      "from": "QUERYABLE",
      "to": "STALE",
      "requires": [
        "valid_scope",
        "authority",
        "permission",
        "evidence_or_explicit_not_run"
      ]
    },
    {
      "from": "STALE",
      "to": "REBUILDING",
      "requires": [
        "valid_scope",
        "authority",
        "permission",
        "evidence_or_explicit_not_run"
      ]
    },
    {
      "from": "REBUILDING",
      "to": "QUARANTINED",
      "requires": [
        "valid_scope",
        "authority",
        "permission",
        "evidence_or_explicit_not_run"
      ]
    }
  ],
  "fail_closed_on": [
    "dangling or stale projection is treated as authority",
    "missing authority",
    "stale evidence",
    "semantic contradiction"
  ],
  "recovery": [
    "stop affected action",
    "restore checkpoint or safe state",
    "repair canonical source/policy",
    "rerun transitive checks"
  ],
  "approval_boundary": [
    "external_write",
    "destructive_action",
    "credential_access",
    "publication",
    "financial_commitment",
    "permission_expansion"
  ],
  "invalidation_triggers": [
    "requirement_change",
    "schema_change",
    "policy_change",
    "interface_change",
    "security_change",
    "candidate_hash_change"
  ]
}
