{
  "schema_version": "1.0.0",
  "module_id": "ABS.MODULE.ARCHITECTURE.MODULARITY",
  "policy_version": "1.0.0",
  "scope_id": "ABS.SCOPE.ABS_MODULE_ARCHITECTURE_MODULARITY.OPERATING_CONTRACT",
  "truth_scope": [
    "ABS.CONCEPT.MODULAR_ARCHITECTURE"
  ],
  "default_action": "DENY_UNLESS_SCOPE_AUTHORITY_PERMISSION_AND_EVIDENCE_ARE_VALID",
  "rules": [
    {
      "rule_id": "ABS.MODULE.ARCHITECTURE.MODULARITY.RULE.001",
      "requirement_id": "ABS.REQ.MODULAR_ARCHITECTURE.001",
      "condition": "governed action or claim is in module scope",
      "effect": "REQUIRE_CONFORMANCE_AND_EVIDENCE",
      "on_failure": "BLOCK_AND_RECORD_FINDING"
    },
    {
      "rule_id": "ABS.MODULE.ARCHITECTURE.MODULARITY.RULE.002",
      "requirement_id": "ABS.REQ.MODULAR_ARCHITECTURE.002",
      "condition": "governed action or claim is in module scope",
      "effect": "REQUIRE_CONFORMANCE_AND_EVIDENCE",
      "on_failure": "BLOCK_AND_RECORD_FINDING"
    },
    {
      "rule_id": "ABS.MODULE.ARCHITECTURE.MODULARITY.RULE.003",
      "requirement_id": "ABS.REQ.MODULAR_ARCHITECTURE.003",
      "condition": "governed action or claim is in module scope",
      "effect": "REQUIRE_CONFORMANCE_AND_EVIDENCE",
      "on_failure": "BLOCK_AND_RECORD_FINDING"
    }
  ],
  "states": [
    "PROPOSED",
    "PLACED",
    "WIRED",
    "VALIDATED",
    "DEPRECATED"
  ],
  "transitions": [
    {
      "from": "PROPOSED",
      "to": "PLACED",
      "requires": [
        "valid_scope",
        "authority",
        "permission",
        "evidence_or_explicit_not_run"
      ]
    },
    {
      "from": "PLACED",
      "to": "WIRED",
      "requires": [
        "valid_scope",
        "authority",
        "permission",
        "evidence_or_explicit_not_run"
      ]
    },
    {
      "from": "WIRED",
      "to": "VALIDATED",
      "requires": [
        "valid_scope",
        "authority",
        "permission",
        "evidence_or_explicit_not_run"
      ]
    },
    {
      "from": "VALIDATED",
      "to": "DEPRECATED",
      "requires": [
        "valid_scope",
        "authority",
        "permission",
        "evidence_or_explicit_not_run"
      ]
    }
  ],
  "fail_closed_on": [
    "provider/project specifics contaminate kernel",
    "missing authority",
    "stale evidence",
    "semantic contradiction"
  ],
  "recovery": [
    "stop affected action",
    "restore checkpoint or safe state",
    "repair canonical source/policy",
    "rerun transitive checks"
  ],
  "approval_boundary": [
    "external_write",
    "destructive_action",
    "credential_access",
    "publication",
    "financial_commitment",
    "permission_expansion"
  ],
  "invalidation_triggers": [
    "requirement_change",
    "schema_change",
    "policy_change",
    "interface_change",
    "security_change",
    "candidate_hash_change"
  ]
}
