{
  "schema_version": "1.0.0",
  "module_id": "ABS.MODULE.CONTROL.DECISIONS",
  "policy_version": "1.0.0",
  "scope_id": "ABS.SCOPE.ABS_MODULE_CONTROL_DECISIONS.OPERATING_CONTRACT",
  "truth_scope": [
    "ABS.CONCEPT.DECISIONS_RISKS_UNKNOWNS"
  ],
  "default_action": "DENY_UNLESS_SCOPE_AUTHORITY_PERMISSION_AND_EVIDENCE_ARE_VALID",
  "rules": [
    {
      "rule_id": "ABS.MODULE.CONTROL.DECISIONS.RULE.001",
      "requirement_id": "ABS.REQ.DECISIONS_RISKS_UNKNOWNS.001",
      "condition": "governed action or claim is in module scope",
      "effect": "REQUIRE_CONFORMANCE_AND_EVIDENCE",
      "on_failure": "BLOCK_AND_RECORD_FINDING"
    },
    {
      "rule_id": "ABS.MODULE.CONTROL.DECISIONS.RULE.002",
      "requirement_id": "ABS.REQ.DECISIONS_RISKS_UNKNOWNS.002",
      "condition": "governed action or claim is in module scope",
      "effect": "REQUIRE_CONFORMANCE_AND_EVIDENCE",
      "on_failure": "BLOCK_AND_RECORD_FINDING"
    },
    {
      "rule_id": "ABS.MODULE.CONTROL.DECISIONS.RULE.003",
      "requirement_id": "ABS.REQ.DECISIONS_RISKS_UNKNOWNS.003",
      "condition": "governed action or claim is in module scope",
      "effect": "REQUIRE_CONFORMANCE_AND_EVIDENCE",
      "on_failure": "BLOCK_AND_RECORD_FINDING"
    }
  ],
  "states": [
    "OPEN",
    "PROPOSED",
    "APPROVED",
    "REJECTED",
    "DEFERRED",
    "EXPIRED",
    "REOPENED"
  ],
  "transitions": [
    {
      "from": "OPEN",
      "to": "PROPOSED",
      "requires": [
        "valid_scope",
        "authority",
        "permission",
        "evidence_or_explicit_not_run"
      ]
    },
    {
      "from": "PROPOSED",
      "to": "APPROVED",
      "requires": [
        "valid_scope",
        "authority",
        "permission",
        "evidence_or_explicit_not_run"
      ]
    },
    {
      "from": "APPROVED",
      "to": "REJECTED",
      "requires": [
        "valid_scope",
        "authority",
        "permission",
        "evidence_or_explicit_not_run"
      ]
    },
    {
      "from": "REJECTED",
      "to": "DEFERRED",
      "requires": [
        "valid_scope",
        "authority",
        "permission",
        "evidence_or_explicit_not_run"
      ]
    },
    {
      "from": "DEFERRED",
      "to": "EXPIRED",
      "requires": [
        "valid_scope",
        "authority",
        "permission",
        "evidence_or_explicit_not_run"
      ]
    },
    {
      "from": "EXPIRED",
      "to": "REOPENED",
      "requires": [
        "valid_scope",
        "authority",
        "permission",
        "evidence_or_explicit_not_run"
      ]
    }
  ],
  "fail_closed_on": [
    "unknown or waiver is converted into permanent fact",
    "missing authority",
    "stale evidence",
    "semantic contradiction"
  ],
  "recovery": [
    "stop affected action",
    "restore checkpoint or safe state",
    "repair canonical source/policy",
    "rerun transitive checks"
  ],
  "approval_boundary": [
    "external_write",
    "destructive_action",
    "credential_access",
    "publication",
    "financial_commitment",
    "permission_expansion"
  ],
  "invalidation_triggers": [
    "requirement_change",
    "schema_change",
    "policy_change",
    "interface_change",
    "security_change",
    "candidate_hash_change"
  ]
}
