{
  "schema_version": "1.0.0",
  "module_id": "ABS.MODULE.CAPABILITY.ROUTING",
  "policy_version": "1.0.0",
  "scope_id": "ABS.SCOPE.ABS_MODULE_CAPABILITY_ROUTING.OPERATING_CONTRACT",
  "truth_scope": [
    "ABS.CONCEPT.MODEL_ROUTING"
  ],
  "default_action": "DENY_UNLESS_SCOPE_AUTHORITY_PERMISSION_AND_EVIDENCE_ARE_VALID",
  "rules": [
    {
      "rule_id": "ABS.MODULE.CAPABILITY.ROUTING.RULE.001",
      "requirement_id": "ABS.REQ.MODEL_ROUTING.001",
      "condition": "governed action or claim is in module scope",
      "effect": "REQUIRE_CONFORMANCE_AND_EVIDENCE",
      "on_failure": "BLOCK_AND_RECORD_FINDING"
    },
    {
      "rule_id": "ABS.MODULE.CAPABILITY.ROUTING.RULE.002",
      "requirement_id": "ABS.REQ.MODEL_ROUTING.002",
      "condition": "governed action or claim is in module scope",
      "effect": "REQUIRE_CONFORMANCE_AND_EVIDENCE",
      "on_failure": "BLOCK_AND_RECORD_FINDING"
    },
    {
      "rule_id": "ABS.MODULE.CAPABILITY.ROUTING.RULE.003",
      "requirement_id": "ABS.REQ.MODEL_ROUTING.003",
      "condition": "governed action or claim is in module scope",
      "effect": "REQUIRE_CONFORMANCE_AND_EVIDENCE",
      "on_failure": "BLOCK_AND_RECORD_FINDING"
    }
  ],
  "states": [
    "CLASSIFIED",
    "ROUTED",
    "EXECUTING",
    "FALLBACK",
    "CHECKPOINTED",
    "VERIFIED"
  ],
  "transitions": [
    {
      "from": "CLASSIFIED",
      "to": "ROUTED",
      "requires": [
        "valid_scope",
        "authority",
        "permission",
        "evidence_or_explicit_not_run"
      ]
    },
    {
      "from": "ROUTED",
      "to": "EXECUTING",
      "requires": [
        "valid_scope",
        "authority",
        "permission",
        "evidence_or_explicit_not_run"
      ]
    },
    {
      "from": "EXECUTING",
      "to": "FALLBACK",
      "requires": [
        "valid_scope",
        "authority",
        "permission",
        "evidence_or_explicit_not_run"
      ]
    },
    {
      "from": "FALLBACK",
      "to": "CHECKPOINTED",
      "requires": [
        "valid_scope",
        "authority",
        "permission",
        "evidence_or_explicit_not_run"
      ]
    },
    {
      "from": "CHECKPOINTED",
      "to": "VERIFIED",
      "requires": [
        "valid_scope",
        "authority",
        "permission",
        "evidence_or_explicit_not_run"
      ]
    }
  ],
  "fail_closed_on": [
    "routing lowers assurance or violates confidentiality",
    "missing authority",
    "stale evidence",
    "semantic contradiction"
  ],
  "recovery": [
    "stop affected action",
    "restore checkpoint or safe state",
    "repair canonical source/policy",
    "rerun transitive checks"
  ],
  "approval_boundary": [
    "external_write",
    "destructive_action",
    "credential_access",
    "publication",
    "financial_commitment",
    "permission_expansion"
  ],
  "invalidation_triggers": [
    "requirement_change",
    "schema_change",
    "policy_change",
    "interface_change",
    "security_change",
    "candidate_hash_change"
  ]
}
