{
  "schema_version": "1.0.0",
  "module_id": "ABS.MODULE.ADDON.KNOWLEDGE",
  "policy_version": "1.0.0",
  "scope_id": "ABS.SCOPE.ABS_MODULE_ADDON_KNOWLEDGE.OPERATING_CONTRACT",
  "truth_scope": [
    "ABS.CONCEPT.OPTIONAL_RAG_GRAPH"
  ],
  "default_action": "DENY_UNLESS_SCOPE_AUTHORITY_PERMISSION_AND_EVIDENCE_ARE_VALID",
  "rules": [
    {
      "rule_id": "ABS.MODULE.ADDON.KNOWLEDGE.RULE.001",
      "requirement_id": "ABS.REQ.OPTIONAL_RAG_GRAPH.001",
      "condition": "governed action or claim is in module scope",
      "effect": "REQUIRE_CONFORMANCE_AND_EVIDENCE",
      "on_failure": "BLOCK_AND_RECORD_FINDING"
    },
    {
      "rule_id": "ABS.MODULE.ADDON.KNOWLEDGE.RULE.002",
      "requirement_id": "ABS.REQ.OPTIONAL_RAG_GRAPH.002",
      "condition": "governed action or claim is in module scope",
      "effect": "REQUIRE_CONFORMANCE_AND_EVIDENCE",
      "on_failure": "BLOCK_AND_RECORD_FINDING"
    },
    {
      "rule_id": "ABS.MODULE.ADDON.KNOWLEDGE.RULE.003",
      "requirement_id": "ABS.REQ.OPTIONAL_RAG_GRAPH.003",
      "condition": "governed action or claim is in module scope",
      "effect": "REQUIRE_CONFORMANCE_AND_EVIDENCE",
      "on_failure": "BLOCK_AND_RECORD_FINDING"
    }
  ],
  "states": [
    "DISABLED",
    "PILOT",
    "APPROVED",
    "ACTIVE",
    "STALE",
    "DEGRADED",
    "REMOVED"
  ],
  "transitions": [
    {
      "from": "DISABLED",
      "to": "PILOT",
      "requires": [
        "valid_scope",
        "authority",
        "permission",
        "evidence_or_explicit_not_run"
      ]
    },
    {
      "from": "PILOT",
      "to": "APPROVED",
      "requires": [
        "valid_scope",
        "authority",
        "permission",
        "evidence_or_explicit_not_run"
      ]
    },
    {
      "from": "APPROVED",
      "to": "ACTIVE",
      "requires": [
        "valid_scope",
        "authority",
        "permission",
        "evidence_or_explicit_not_run"
      ]
    },
    {
      "from": "ACTIVE",
      "to": "STALE",
      "requires": [
        "valid_scope",
        "authority",
        "permission",
        "evidence_or_explicit_not_run"
      ]
    },
    {
      "from": "STALE",
      "to": "DEGRADED",
      "requires": [
        "valid_scope",
        "authority",
        "permission",
        "evidence_or_explicit_not_run"
      ]
    },
    {
      "from": "DEGRADED",
      "to": "REMOVED",
      "requires": [
        "valid_scope",
        "authority",
        "permission",
        "evidence_or_explicit_not_run"
      ]
    }
  ],
  "fail_closed_on": [
    "projection outranks canonical source or leaks restricted content",
    "missing authority",
    "stale evidence",
    "semantic contradiction"
  ],
  "recovery": [
    "stop affected action",
    "restore checkpoint or safe state",
    "repair canonical source/policy",
    "rerun transitive checks"
  ],
  "approval_boundary": [
    "external_write",
    "destructive_action",
    "credential_access",
    "publication",
    "financial_commitment",
    "permission_expansion"
  ],
  "invalidation_triggers": [
    "requirement_change",
    "schema_change",
    "policy_change",
    "interface_change",
    "security_change",
    "candidate_hash_change"
  ]
}
